[
  {
    "asset_id": "8e7d6c5b-4a39-4281-9f0e-1d2c3b4a5968",
    "label": "가상동 4-2",
    "location_point": [
      126.9996,
      37.5705
    ],
    "data_mode": "synthetic",
    "created_at": "2026-09-22T10:20:00+09:00",
    "notes": "현장에서 만듦 (가상)",
    "pnu": "9999900100100040002",
    "origin": "device"
  }
]
